{
  "schema_version": "1.0",
  "name": "core_hr_vs_payroll",
  "left": {
    "name": "core_hr"
  },
  "right": {
    "name": "payroll"
  },
  "identity": {
    "left": "person_id",
    "right": "employee_number",
    "normalize": []
  },
  "fields": [
    {
      "name": "first_name",
      "left": "first_name",
      "right": "given_name",
      "mode": "Custom",
      "normalize": [
        "trim",
        "casefold"
      ],
      "value_mapping": null
    },
    {
      "name": "last_name",
      "left": "last_name",
      "right": "surname",
      "mode": "Custom",
      "normalize": [
        "trim",
        "casefold"
      ],
      "value_mapping": null
    },
    {
      "name": "company",
      "left": "company",
      "right": "company_code",
      "mode": "Value mapping",
      "normalize": [],
      "value_mapping": "company"
    }
  ],
  "value_mappings": {
    "company": {
      "DE_GERMANY": {
        "left": [
          "DE01"
        ],
        "right": [
          "1000"
        ]
      },
      "CH_SWITZERLAND": {
        "left": [
          "CH01"
        ],
        "right": [
          "2000"
        ]
      }
    }
  }
}
