{
  "schema_version": "1.0",
  "name": "status_matrix",
  "left": {
    "name": "left"
  },
  "right": {
    "name": "right"
  },
  "identity": {
    "left": "id",
    "right": "id",
    "normalize": []
  },
  "fields": [
    {
      "name": "text",
      "left": "text",
      "right": "text",
      "mode": "Custom",
      "normalize": [
        "trim",
        "casefold"
      ],
      "value_mapping": null
    },
    {
      "name": "mapped",
      "left": "mapped",
      "right": "mapped",
      "mode": "Value mapping",
      "normalize": [],
      "value_mapping": "codes"
    }
  ],
  "value_mappings": {
    "codes": {
      "CANONICAL": {
        "left": [
          "L"
        ],
        "right": [
          "R"
        ]
      }
    }
  }
}
